<Payload xmlns="http://javaops.ru"
         xmlns:xsi="http://www.w3.org/2001/XMLSchema-instance"
         xsi:schemaLocation="http://javaops.ru payload_hw.xsd">

    <Projects>
        <Groups>
            <Group status="FINISHED" name="topjava">
                <Users>
                    <User flag="active" city="kiv" email="gmail@gmail.com">
                        <fullName>Full Name</fullName>
                    </User>
                    <User flag="superuser" city="spb" email="admin@javaops.ru">
                        <fullName>Admin</fullName>
                    </User>
                    <User flag="deleted" city="spb" email="mail@yandex.ru">
                        <fullName>Deleted</fullName>
                    </User>
                </Users>
            </Group>
            <Group status="CURRENT" name="masterjava">
                <Users>
                    <User flag="superuser" city="spb" email="admin@javaops.ru">
                        <fullName>Admin</fullName>
                    </User>
                    <User flag="active" city="mnsk" email="demis@gmail.com">
                        <fullName>Denis Katsuk</fullName>
                    </User>
                    <User flag="active" city="spb" email="mail@yandex.ru">
                        <fullName>Petya</fullName>
                    </User>
                </Users>
            </Group>
            <Group status="REGISTERING" name="masterjava">
                <Users>
                    <User flag="superuser" city="spb" email="admin@javaops.ru">
                        <fullName>Admin</fullName>
                    </User>
                    <User flag="active" city="mglv" email="demis@gmail.com">
                        <fullName>Vasya</fullName>
                    </User>
                </Users>
            </Group>
        </Groups>
    </Projects>
    <Cities>
        <City id="spb">Санкт-Петербург</City>
        <City id="kiv">Киев</City>
        <City id="mnsk">Минск</City>
        <City id="mglv">Могилев</City>
    </Cities>
</Payload>